CCASS ID,Name,Holding,Change,Stake%,StakeΔ %,Lastholding
C00048,CHIYU BANKING CORPORATION LTD,10994000,730000,0.14,0.01,2010-05-12
C00039,STANDARD CHARTERED BANK (HONG KONG) LTD,23184000,-40000,0.29,-0.0,2010-05-12
C00033,BANK OF CHINA (HONG KONG) LTD,117486000,-1252000,1.48,-0.02,2010-05-12
C00019,THE HONGKONG AND SHANGHAI BANKING,107608000,-964000,1.36,-0.01,2010-05-12
C00010,CITIBANK N.A.,6300738,30000,0.08,0.0,2010-05-12
C00003,THE BANK OF EAST ASIA LTD,6422000,800000,0.08,0.01,2010-05-12
C00002,BANK OF COMMUNICATIONS TRUSTEE LTD,22836000,404000,0.29,0.01,2010-05-12
B01850,HAI TONG SECURITIES (HK) BROKERAGE LTD,692806000,-200000,8.74,-0.0,2010-05-12
B01843,TD KING SECURITIES LTD,2332000,200000,0.03,0.0,2010-05-12
B01842,BOCOM INTERNATIONAL SECURITIES LTD,2250000,100000,0.03,0.0,2010-05-12
B01818,I-ACCESS INVESTORS LTD,1506000,-8000,0.02,-0.0,2010-05-12
B01789,HO FUNG SHARES INVESTMENT LTD,2454943,-250000,0.03,-0.0,2010-05-12
B01787,SOO PUI CHEN SECURITIES LTD,420000,200000,0.01,0.0,2010-05-12
B01778,UNITED WORLD ONLINE LTD,2288000,10000,0.03,0.0,2010-05-12
B01776,AIF SECURITIES LTD,610000,100000,0.01,0.0,2010-05-12
B01771,CVP SECURITIES LTD,430000,-200000,0.01,-0.0,2010-05-12
B01769,ONE CHINA SECURITIES LTD,8534058,-300000,0.11,-0.0,2010-05-12
B01761,KO'S BROTHER SECURITIES CO LTD,484000,100000,0.01,0.0,2010-05-12
B01700,REALINK FINANCIAL TRADE LTD,706000,-200000,0.01,-0.0,2010-05-12
B01676,TAI SHING STOCK INVESTMENT CO LTD,2304000,-400000,0.03,-0.01,2010-05-12
B01673,FULBRIGHT SECURITIES LTD,14780000,-500000,0.19,-0.01,2010-05-12
B01659,CHEER UNION SECURITIES LTD,0,-200000,0.0,-0.0,2010-05-12
B01607,RHB SECURITIES HONG KONG LTD,14146000,310000,0.18,0.0,2010-05-12
B01605,ESSENCE INTERNATIONAL FINANCIAL HOLDINGS,30000,-300000,0.0,-0.0,2010-05-12
B01584,CHIEF SECURITIES LTD,8778000,-84000,0.11,-0.0,2010-05-12
B01569,TANG PING KONG LTD,100000,-200000,0.0,-0.0,2010-05-12
B01565,GUOTAI JUNAN SECURITIES (HONG KONG) LTD,2294000,-54000,0.03,-0.0,2010-05-12
B01563,HUARONG INTERNATIONAL SECURITIES LTD,3816000,-50000,0.05,-0.0,2010-05-12
B01545,TUNG SHING SECURITIES (BROKERS) LTD,14596000,1150000,0.18,0.01,2010-05-12
B01493,YARDLEY SECURITIES LTD,1530000,-200000,0.02,-0.0,2010-05-12
B01483,BULLISH SECURITIES LTD,880000,-200000,0.01,-0.0,2010-05-12
B01460,BERICH BROKERAGE LTD,1300000,1000000,0.02,0.01,2010-05-12
B01451,GOLDMAN SACHS (ASIA) SECURITIES LTD,20000,-84000,0.0,-0.0,2010-05-12
B01443,YING WAH SECURITIES CO LTD,380000,100000,0.0,0.0,2010-05-12
B01427,SINCERE SECURITIES LTD,1010000,100000,0.01,0.0,2010-05-12
B01423,PRUDENTIAL BROKERAGE LTD,23138000,-972000,0.29,-0.01,2010-05-12
B01416,VC BROKERAGE LTD,2656000,500000,0.03,0.01,2010-05-12
B01345,PHILLIP SECURITIES (HONG KONG) LTD,11736000,316000,0.15,0.0,2010-05-12
B01338,EMPEROR SECURITIES LTD,3718000,-54000,0.05,-0.0,2010-05-12
B01330,NOMURA SECURITIES (HK) LTD,1118000,1000000,0.01,0.01,2010-05-12
B01284,HANG SENG SECURITIES LTD,60648000,2380000,0.76,0.03,2010-05-12
B01271,HANG TAI SECURITIES LTD,3480000,-844000,0.04,-0.01,2010-05-12
B01266,PREMIER Q SECURITIES LTD,89316000,-1174000,1.13,-0.01,2010-05-12
B01265,OCBC WING HANG SHARES BROKERAGE CO. LTD,5830000,-16000,0.07,-0.0,2010-05-12
B01231,HONG KONG INTERNATIONAL SECURITIES LTD,844000,-100000,0.01,-0.0,2010-05-12
B01230,PACIFIC FOUNDATION SECURITIES LTD,390000,190000,0.0,0.0,2010-05-12
B01228,CITIC SECURITIES BROKERAGE (HK) LTD,15958000,-110000,0.2,-0.0,2010-05-12
B01224,MERRILL LYNCH FAR EAST LTD,478000,-154000,0.01,-0.0,2010-05-12
B01217,TAIPING SECURITIES (HK) CO LTD,12136000,200000,0.15,0.0,2010-05-12
B01212,HENYEP SECURITIES LTD,4372000,-100000,0.06,-0.0,2010-05-12
B01192,SEEKERS MARKETS LTD,68000,-40000,0.0,-0.0,2010-05-12
B01191,OKACHI INVESTMENTS (HONG KONG) CO LTD,1020000,-160000,0.01,-0.0,2010-05-12
B01183,CHONG HING SECURITIES LTD,9214000,-200000,0.12,-0.0,2010-05-12
B01158,SOLID KING SECURITIES LTD,3050000,-200000,0.04,-0.0,2010-05-12
B01148,CHINA MERCHANTS SECURITIES (HK) CO LTD,8622000,-464000,0.11,-0.01,2010-05-12
B01143,HAITONG INTERNATIONAL SECURITIES CO LTD,14510000,-232000,0.18,-0.0,2010-05-12
B01130,BOCI SECURITIES LTD,63996000,-1498000,0.81,-0.02,2010-05-12
B01119,CELESTIAL SECURITIES LTD,9898000,-200000,0.12,-0.0,2010-05-12
B01118,EAST ASIA SECURITIES CO LTD,12274000,420000,0.15,0.01,2010-05-12
B01115,SHENWAN HONGYUAN SECURITIES (H.K.) LTD,6334000,1972000,0.08,0.02,2010-05-12
B01086,SUN HUNG KAI INVESTMENT SERVICES LTD,6980000,-108000,0.09,-0.0,2010-05-12
,Total changed named holdings,1447399739,0,18.25,0.0,
,Unchanged named holdings,678647902,0,8.56,0.0,
,Total named holdings,2126047641,0,26.81,0.0,
,Unnamed Investor Participants,9562000,0,0.12,0.0,
,Total securities in CCASS,2135609641,0,26.93,0.0,
,Securities not in CCASS,5794557043,0,73.07,0.0,
,Issued securities,7930166684,0,100.0,0.0,30-Apr-2010
