CCASS ID,Name,Holding,Change,Stake%,StakeΔ %,Lastholding
C00048,CHIYU BANKING CORPORATION LTD,3326000,270000,0.04,0.0,2010-02-22
C00041,OCBC WING HANG BANK LTD,6408000,-562000,0.08,-0.01,2010-02-22
C00039,STANDARD CHARTERED BANK (HONG KONG) LTD,7636000,258000,0.1,0.0,2010-02-22
C00037,SHANGHAI COMMERCIAL BANK LTD,7618000,100000,0.1,0.0,2010-02-22
C00033,BANK OF CHINA (HONG KONG) LTD,71274000,3732000,0.9,0.05,2010-02-22
C00028,NANYANG COMMERCIAL BANK LTD,3338000,250000,0.04,0.0,2010-02-22
C00019,THE HONGKONG AND SHANGHAI BANKING,74378000,22942000,0.94,0.29,2010-02-22
C00010,CITIBANK N.A.,3674738,240000,0.05,0.0,2010-02-22
C00002,BANK OF COMMUNICATIONS TRUSTEE LTD,12330000,470000,0.16,0.01,2010-02-22
B01866,ICBC INTERNATIONAL SECURITIES LTD,0,-400000,0.0,-0.01,2010-02-22
B01859,CLC SECURITIES LTD,260000,10000,0.0,0.0,2010-02-22
B01853,CMBC SECURITIES CO LTD,250000,250000,0.0,0.0,2010-02-22
B01850,HAI TONG SECURITIES (HK) BROKERAGE LTD,1425518000,-42838000,17.98,-0.54,2010-02-22
B01843,TD KING SECURITIES LTD,428000,44000,0.01,0.0,2010-02-22
B01842,BOCOM INTERNATIONAL SECURITIES LTD,2110000,140000,0.03,0.0,2010-02-22
B01818,I-ACCESS INVESTORS LTD,516000,120000,0.01,0.0,2010-02-22
B01776,AIF SECURITIES LTD,110000,-200000,0.0,-0.0,2010-02-22
B01771,CVP SECURITIES LTD,330000,210000,0.0,0.0,2010-02-22
B01769,ONE CHINA SECURITIES LTD,200058,200000,0.0,0.0,2010-02-22
B01749,TANG KEE SECURITIES LTD,243520,40000,0.0,0.0,2010-02-22
B01745,EVERGREEN SECURITIES LTD,1700000,100000,0.02,0.0,2010-02-22
B01731,SHUN HENG SECURITIES LTD,780000,210000,0.01,0.0,2010-02-22
B01727,ICBC (ASIA) SECURITIES LTD,6860000,200000,0.09,0.0,2010-02-22
B01705,HENIK SECURITIES LTD,692000,200000,0.01,0.0,2010-02-22
B01700,REALINK FINANCIAL TRADE LTD,774000,240000,0.01,0.0,2010-02-22
B01695,DAH SING SECURITIES LTD,1680000,-28000,0.02,-0.0,2010-02-22
B01673,FULBRIGHT SECURITIES LTD,474000,130000,0.01,0.0,2010-02-22
B01668,BRIGHT SMART SECURITIES INTERNATIONAL,1406000,380000,0.02,0.0,2010-02-22
B01649,CINDA INTERNATIONAL SECURITIES LTD,888000,100000,0.01,0.0,2010-02-22
B01638,KILMOREY SECURITIES LTD,1560000,1110000,0.02,0.01,2010-02-22
B01610,KGI ASIA LTD,5150000,380000,0.06,0.0,2010-02-22
B01606,EWARTON SECURITIES LTD,0,-200000,0.0,-0.0,2010-02-22
B01599,POLARIS SECURITIES (HONG KONG) LTD,730000,400000,0.01,0.01,2010-02-22
B01585,SINO GRADE SECURITIES LTD,758000,34000,0.01,0.0,2010-02-22
B01584,CHIEF SECURITIES LTD,5680000,602000,0.07,0.01,2010-02-22
B01570,GOLDENWAY SECURITIES CO LTD,260000,-100000,0.0,-0.0,2010-02-22
B01565,GUOTAI JUNAN SECURITIES (HONG KONG) LTD,1470000,132000,0.02,0.0,2010-02-22
B01563,HUARONG INTERNATIONAL SECURITIES LTD,646000,120000,0.01,0.0,2010-02-22
B01552,CARRIER STOCK INVESTMENT CO LTD,100000,100000,0.0,0.0,2010-02-22
B01545,TUNG SHING SECURITIES (BROKERS) LTD,9916000,-8000,0.13,-0.0,2010-02-22
B01519,GOOD HARVEST SECURITIES CO LTD,1850000,-100000,0.02,-0.0,2010-02-22
B01514,KARL-THOMSON SECURITIES CO LTD,844000,-50000,0.01,-0.0,2010-02-22
B01470,HUNG SING SECURITIES LTD,400000,300000,0.01,0.0,2010-02-22
B01469,KAISER SECURITIES LTD,4360000,152000,0.05,0.0,2010-02-22
B01451,GOLDMAN SACHS (ASIA) SECURITIES LTD,176000,-4000,0.0,-0.0,2010-02-22
B01434,BEEVEST SECURITIES LTD,1400000,380000,0.02,0.0,2010-02-22
B01425,WELLFULL SECURITIES CO LTD,2366000,300000,0.03,0.0,2010-02-22
B01423,PRUDENTIAL BROKERAGE LTD,920000,10000,0.01,0.0,2010-02-22
B01413,CORE PACIFIC - YAMAICHI INTERNATIONAL,3530000,-50000,0.04,-0.0,2010-02-22
B01407,WIN WONG SECURITIES LTD,770000,300000,0.01,0.0,2010-02-22
B01403,QUEST STOCKBROKERS (HK) LTD,44000,40000,0.0,0.0,2010-02-22
B01389,ZHONGRONG PT SECURITIES LTD,670000,-100000,0.01,-0.0,2010-02-22
B01356,DELTA ASIA SECURITIES LTD,490000,120000,0.01,0.0,2010-02-22
B01345,PHILLIP SECURITIES (HONG KONG) LTD,7282000,478000,0.09,0.01,2010-02-22
B01338,EMPEROR SECURITIES LTD,3332000,-610000,0.04,-0.01,2010-02-22
B01326,MORGAN FUEL GO SECURITIES LTD,320000,300000,0.0,0.0,2010-02-22
B01324,FUNDERSTONE SECURITIES LTD,1904000,-50000,0.02,-0.0,2010-02-22
B01320,LUEN FAT SECURITIES CO LTD,1354000,560000,0.02,0.01,2010-02-22
B01284,HANG SENG SECURITIES LTD,30604000,1080000,0.39,0.01,2010-02-22
B01280,WING FAT SECURITIES LTD,130000,100000,0.0,0.0,2010-02-22
B01265,OCBC WING HANG SHARES BROKERAGE CO. LTD,180000,50000,0.0,0.0,2010-02-22
B01228,CITIC SECURITIES BROKERAGE (HK) LTD,8764000,1554000,0.11,0.02,2010-02-22
B01224,MERRILL LYNCH FAR EAST LTD,320000,-6000,0.0,-0.0,2010-02-22
B01213,MALAHON SECURITIES LTD,100000,-60000,0.0,-0.0,2010-02-22
B01192,SEEKERS MARKETS LTD,328000,-60000,0.0,-0.0,2010-02-22
B01183,CHONG HING SECURITIES LTD,5516000,350000,0.07,0.0,2010-02-22
B01156,CMB INTERNATIONAL GLOBAL MARKETS LTD,8948000,-250000,0.11,-0.0,2010-02-22
B01148,CHINA MERCHANTS SECURITIES (HK) CO LTD,880000,-100000,0.01,-0.0,2010-02-22
B01143,HAITONG INTERNATIONAL SECURITIES CO LTD,8542000,4714000,0.11,0.06,2010-02-22
B01137,CHOW SANG SANG SECURITIES LTD,974000,-40000,0.01,-0.0,2010-02-22
B01130,BOCI SECURITIES LTD,45618000,318000,0.58,0.0,2010-02-22
B01119,CELESTIAL SECURITIES LTD,7038000,546000,0.09,0.01,2010-02-22
B01118,EAST ASIA SECURITIES CO LTD,14006000,150000,0.18,0.0,2010-02-22
B01115,SHENWAN HONGYUAN SECURITIES (H.K.) LTD,3948000,-100000,0.05,-0.0,2010-02-22
B01086,SUN HUNG KAI INVESTMENT SERVICES LTD,2926000,330000,0.04,0.0,2010-02-22
,Total changed named holdings,1832306316,-70000,23.11,-0.0,
,Unchanged named holdings,117294149,0,1.48,0.0,
,Total named holdings,1949600465,-70000,24.58,0.0,
,Unnamed Investor Participants,9346000,0,0.12,0.0,
,Total securities in CCASS,1958946465,-70000,24.7,-0.0,
,Securities not in CCASS,5971220219,70000,75.3,0.0,
,Issued securities,7930166684,0,100.0,0.0,31-Jan-2010
